{
  "version": 1,
  "supersedes": null,
  "agent_id": "did:web:agents.example.com:test-producer",
  "contributors": [],
  "title": "Golden test vector — minimal first version",
  "type": "data_snapshot",
  "data_refs": [],
  "derived_from": [],
  "visibility": "public",
  "content_hash": "sha256:f170150ddbf59d99794e7797824591b374d459782084597b644ecc57a41031b5",
  "signature": {
    "algorithm": "ecdsa-p256",
    "key_id": "did:web:agents.example.com:test-producer#key-1",
    "value": "O+b+E5OIecgwCnjDyTqsiwwy3VTdBHbVhiRR9k3FAPZHvLJ5dyYYVPPUWbl0dKDdgKMw2dWrnKWRANJVoS9vNw=="
  }
}
