{
  "version": 1,
  "supersedes": null,
  "agent_id": "did:web:agents.example.com:market-data-collector",
  "contributors": [],
  "content_hash": "sha256:5f8d88d6758cfd43be875d49edc9eaa494de8ec645bf7de6c592b15bbb1e2e3c",
  "signature": {
    "algorithm": "ed25519",
    "key_id": "did:web:agents.example.com:market-data-collector#key-1",
    "value": "c2lnbmF0dXJlX3BsYWNlaG9sZGVyX2RvX25vdF92ZXJpZnk="
  },
  "title": "BTC Price Snapshot",
  "type": "data_snapshot",
  "domain": "financial_markets",
  "data_refs": [
    {
      "type": "primary_result",
      "location": "postgres://prices_db/snapshots?timestamp=2026-04-16T10:15:00Z",
      "description": "OHLCV data for BTC-USD",
      "format": "json"
    }
  ],
  "derived_from": [],
  "tags": ["bitcoin", "price", "market_open"],
  "data_period": {
    "start": "2026-04-16T10:15:00.000Z",
    "end": "2026-04-16T10:15:00.000Z"
  },
  "expires_at": "2026-04-16T16:15:00.000Z",
  "visibility": "public",
  "summary": "BTC: $43,250.67 (+2.3%), Volume: 15,423 BTC"
}
